{
  "schema": "foxhound.task-shadow-observation",
  "schema_version": 1,
  "candidate": {
    "schema": "foxhound.task-candidate",
    "schema_version": 1,
    "candidate_id": "tc_7e24141c4ba227eabbd784120568d8eb62836a3cb36ba4b2cc4494b080bc6831",
    "source": {
      "system": "gw",
      "kind": "email",
      "record_id": "thread-001",
      "item_id": "action-01",
      "revision": "2222222222222222222222222222222222222222222222222222222222222222"
    },
    "task": {
      "text": "Send the Project Beta decision to Person B",
      "project": "Project Beta",
      "owner": null,
      "due": null
    },
    "evidence": {
      "document_id": "document-002",
      "locator": "action-item-01"
    },
    "created_at": "2030-02-01T09:30:00+00:00"
  },
  "disposition": "unmapped",
  "legacy_task": null,
  "reason_code": "legacy_identity_absent",
  "observed_at": "2030-02-01T09:31:00+00:00"
}
